{"id":"dec_Ff5Ff5Ff5Ff5Ff5Ff5","incident_id":"inc_Ee4Ee4Ee4Ee4Ee4Ee4","incident_revision":3,"type":"VERIFY","reason_code":"SEEN_IN_VIDEO","reason_text":"Se observa a una persona dentro de la zona declarada.","decided_at":"2026-10-19T15:05:00Z","actor_scope":"exercise_session_not_verified_identity","identity_scope":"none","simulated_scope":"no_dispatch_no_institutional_receipt","review_marks":{"expected_revision":2,"viewed_clip":true,"viewed_stills":["stl_Hh7Hh7Hh7Hh7Hh7Hh7"],"acknowledged_unknowns":true}}
